{
  "schemaVersion": "retention-schema.v1",
  "retentionPolicyVersion": "retention-policy.v1",
  "institutionalStatus": "GENERIC_REFERENCE_VALUES_NOT_INSTITUTIONAL_POLICY",
  "profiles": [
    {"id": "APPROVED_COURSE_KNOWLEDGE", "purpose": "Approved course knowledge and source metadata governed outside interaction retention.", "duration": "P365D", "expiryBasis": "CREATED_AT", "storageLocation": "APPROVED_KNOWLEDGE_STORE", "contentPersistence": "CONTENT_ALLOWED", "deletionTriggers": ["EXPIRY", "USER_REQUEST"], "onSessionReset": "NOT_APPLICABLE", "onSessionEnd": "NOT_APPLICABLE", "deletionFailure": {"retry": "BOUNDED_BACKOFF", "recordMetadataOnly": true, "contentMayPersistOnlyUntilDeleted": true}},
    {"id": "SESSION_TEXT", "purpose": "Identity-minimized session text.", "duration": "P1D", "expiryBasis": "SESSION_END", "storageLocation": "LOCAL_ONLY", "contentPersistence": "CONTENT_ALLOWED", "deletionTriggers": ["EXPIRY", "SESSION_RESET", "USER_REQUEST"], "onSessionReset": "DELETE", "onSessionEnd": "KEEP_UNTIL_EXPIRY", "deletionFailure": {"retry": "BOUNDED_BACKOFF", "recordMetadataOnly": true, "contentMayPersistOnlyUntilDeleted": true}},
    {"id": "INTERACTION_METADATA", "purpose": "Identity-minimized interaction provenance and status metadata.", "duration": "P14D", "expiryBasis": "CREATED_AT", "storageLocation": "LOCAL_ONLY", "contentPersistence": "METADATA_ONLY", "deletionTriggers": ["EXPIRY", "USER_REQUEST"], "onSessionReset": "KEEP_UNTIL_EXPIRY", "onSessionEnd": "KEEP_UNTIL_EXPIRY", "deletionFailure": {"retry": "BOUNDED_BACKOFF", "recordMetadataOnly": true, "contentMayPersistOnlyUntilDeleted": true}},
    {"id": "FEEDBACK", "purpose": "Structured identity-minimized feedback without optional report content.", "duration": "P30D", "expiryBasis": "CREATED_AT", "storageLocation": "LOCAL_ONLY", "contentPersistence": "METADATA_ONLY", "deletionTriggers": ["EXPIRY", "USER_REQUEST"], "onSessionReset": "KEEP_UNTIL_EXPIRY", "onSessionEnd": "KEEP_UNTIL_EXPIRY", "deletionFailure": {"retry": "BOUNDED_BACKOFF", "recordMetadataOnly": true, "contentMayPersistOnlyUntilDeleted": true}},
    {"id": "ISSUE_REPORT", "purpose": "Sanitized issue-report category and workflow metadata.", "duration": "P30D", "expiryBasis": "CREATED_AT", "storageLocation": "LOCAL_ONLY", "contentPersistence": "METADATA_ONLY", "deletionTriggers": ["EXPIRY", "USER_REQUEST"], "onSessionReset": "KEEP_UNTIL_EXPIRY", "onSessionEnd": "KEEP_UNTIL_EXPIRY", "deletionFailure": {"retry": "BOUNDED_BACKOFF", "recordMetadataOnly": true, "contentMayPersistOnlyUntilDeleted": true}},
    {"id": "OPTIONAL_RETAINED_REPORT_CONTENT", "purpose": "Explicitly included bounded report content.", "duration": "P7D", "expiryBasis": "CREATED_AT", "storageLocation": "LOCAL_ONLY", "contentPersistence": "CONTENT_ALLOWED", "deletionTriggers": ["EXPIRY", "USER_REQUEST"], "onSessionReset": "KEEP_UNTIL_EXPIRY", "onSessionEnd": "KEEP_UNTIL_EXPIRY", "deletionFailure": {"retry": "BOUNDED_BACKOFF", "recordMetadataOnly": true, "contentMayPersistOnlyUntilDeleted": true}},
    {"id": "SAFETY_OPERATIONS_METADATA", "purpose": "Sanitized safety and operations metadata without raw content.", "duration": "P30D", "expiryBasis": "CREATED_AT", "storageLocation": "LOCAL_ONLY", "contentPersistence": "METADATA_ONLY", "deletionTriggers": ["EXPIRY", "USER_REQUEST"], "onSessionReset": "KEEP_UNTIL_EXPIRY", "onSessionEnd": "KEEP_UNTIL_EXPIRY", "deletionFailure": {"retry": "BOUNDED_BACKOFF", "recordMetadataOnly": true, "contentMayPersistOnlyUntilDeleted": true}},
    {"id": "UPLOAD", "purpose": "Temporary upload pending bounded local processing.", "duration": "PT1H", "expiryBasis": "CREATED_AT", "storageLocation": "LOCAL_ONLY", "contentPersistence": "TRANSIENT_ONLY", "deletionTriggers": ["EXPIRY", "SESSION_RESET", "SESSION_END", "VALIDATION_FAILURE", "CANCELLATION", "STARTUP_RECOVERY"], "onSessionReset": "DELETE", "onSessionEnd": "DELETE", "deletionFailure": {"retry": "BOUNDED_BACKOFF", "recordMetadataOnly": true, "contentMayPersistOnlyUntilDeleted": true}},
    {"id": "GENERATED_TEMPORARY_FILE", "purpose": "Generated temporary file used inside one bounded workflow.", "duration": "PT1H", "expiryBasis": "CREATED_AT", "storageLocation": "LOCAL_ONLY", "contentPersistence": "TRANSIENT_ONLY", "deletionTriggers": ["EXPIRY", "SESSION_RESET", "SESSION_END", "RUN_COMPLETION", "VALIDATION_FAILURE", "CANCELLATION", "STARTUP_RECOVERY"], "onSessionReset": "DELETE", "onSessionEnd": "DELETE", "deletionFailure": {"retry": "BOUNDED_BACKOFF", "recordMetadataOnly": true, "contentMayPersistOnlyUntilDeleted": true}},
    {"id": "RAW_MICROPHONE_AUDIO", "purpose": "Raw microphone audio used only for transient speech processing.", "duration": "PT15M", "expiryBasis": "DELIVERY_COMPLETED_AT", "storageLocation": "LOCAL_ONLY", "contentPersistence": "TRANSIENT_ONLY", "deletionTriggers": ["EXPIRY", "DELIVERY", "SESSION_RESET", "SESSION_END", "VALIDATION_FAILURE", "CANCELLATION", "STARTUP_RECOVERY"], "onSessionReset": "DELETE", "onSessionEnd": "DELETE", "deletionFailure": {"retry": "BOUNDED_BACKOFF", "recordMetadataOnly": true, "contentMayPersistOnlyUntilDeleted": true}},
    {"id": "GENERATED_TTS_AUDIO", "purpose": "Generated speech audio retained only until bounded delivery completes.", "duration": "PT15M", "expiryBasis": "DELIVERY_COMPLETED_AT", "storageLocation": "LOCAL_ONLY", "contentPersistence": "TRANSIENT_ONLY", "deletionTriggers": ["EXPIRY", "DELIVERY", "SESSION_RESET", "SESSION_END", "CANCELLATION", "STARTUP_RECOVERY"], "onSessionReset": "DELETE", "onSessionEnd": "DELETE", "deletionFailure": {"retry": "BOUNDED_BACKOFF", "recordMetadataOnly": true, "contentMayPersistOnlyUntilDeleted": true}},
    {"id": "VERIFIER_WORKSPACE", "purpose": "Temporary isolated verifier workspace and run files.", "duration": "PT1H", "expiryBasis": "RUN_COMPLETED_AT", "storageLocation": "LOCAL_ONLY", "contentPersistence": "TRANSIENT_ONLY", "deletionTriggers": ["EXPIRY", "RUN_COMPLETION", "SESSION_RESET", "SESSION_END", "VALIDATION_FAILURE", "CANCELLATION", "STARTUP_RECOVERY"], "onSessionReset": "DELETE", "onSessionEnd": "DELETE", "deletionFailure": {"retry": "BOUNDED_BACKOFF", "recordMetadataOnly": true, "contentMayPersistOnlyUntilDeleted": true}},
    {"id": "DETERMINISTIC_EVIDENCE", "purpose": "Versioned immutable deterministic evidence without official-grade identity.", "duration": "P14D", "expiryBasis": "RUN_COMPLETED_AT", "storageLocation": "LOCAL_ONLY", "contentPersistence": "CONTENT_ALLOWED", "deletionTriggers": ["EXPIRY", "USER_REQUEST"], "onSessionReset": "KEEP_UNTIL_EXPIRY", "onSessionEnd": "KEEP_UNTIL_EXPIRY", "deletionFailure": {"retry": "BOUNDED_BACKOFF", "recordMetadataOnly": true, "contentMayPersistOnlyUntilDeleted": true}},
    {"id": "DELETION_FAILURE_METADATA", "purpose": "Sanitized metadata required to retry and audit a deletion failure.", "duration": "P30D", "expiryBasis": "DELETION_FAILURE_AT", "storageLocation": "LOCAL_ONLY", "contentPersistence": "METADATA_ONLY", "deletionTriggers": ["EXPIRY", "USER_REQUEST"], "onSessionReset": "NOT_APPLICABLE", "onSessionEnd": "NOT_APPLICABLE", "deletionFailure": {"retry": "BOUNDED_BACKOFF", "recordMetadataOnly": true, "contentMayPersistOnlyUntilDeleted": false}},
    {"id": "EVALUATION_FIXTURE_RESULT", "purpose": "Synthetic or independently approved evaluation fixture and sanitized result.", "duration": "P90D", "expiryBasis": "RUN_COMPLETED_AT", "storageLocation": "LOCAL_ONLY", "contentPersistence": "CONTENT_ALLOWED", "deletionTriggers": ["EXPIRY", "USER_REQUEST"], "onSessionReset": "NOT_APPLICABLE", "onSessionEnd": "NOT_APPLICABLE", "deletionFailure": {"retry": "BOUNDED_BACKOFF", "recordMetadataOnly": true, "contentMayPersistOnlyUntilDeleted": true}},
    {"id": "RETENTION_PROHIBITED", "purpose": "Content that the reference policy prohibits from being persisted.", "duration": "PROHIBITED", "expiryBasis": "NEVER_PERSIST", "storageLocation": "NO_STORAGE", "contentPersistence": "PROHIBITED", "deletionTriggers": ["VALIDATION_FAILURE"], "onSessionReset": "NOT_APPLICABLE", "onSessionEnd": "NOT_APPLICABLE", "deletionFailure": {"retry": "NO_RETRY", "recordMetadataOnly": false, "contentMayPersistOnlyUntilDeleted": false}}
  ]
}
